{
  "$schema": "../schema/title-sequence-reduced.schema.json",
  "id": "opening-reduced",
  "base": "opening",
  "about": "The reduced-motion opening (Ingram, 2026-09-26): the same song and pictures as opening.json, with far fewer cuts, half the movement at half the speed or less (always the middle of each move), a dissolve at every cut and nothing that flashes. Players choose it or the full opening when the GM plays it. Built from opening.json at render time (tools/title-sequence/titleseq/reduced.py), so every picture swapped into the full opening appears here too. Never synced to the Foundry server, like opening.json.",
  "motion": 0.5,
  "dissolve": 8,
  "segments": [
    { "shots": ["R00", "R01"], "until": 0.842, "motion": 1.0, "note": "The black leader and the ripple, played as they are. Ingram (2026-09-26): the ripple is not strong enough to cause any issues, and the intro isn't as nice without it." },
    { "shot": "R02", "until": 5.933 },
    { "shot": "R03", "until": 8.988 },
    { "shot": "R04", "until": 13.267, "note": "Held through the burst and the smoke strobe, which are left out." },
    { "shot": "R07", "until": 16.766, "note": "The wordmark card, held through the flashing blue reveal." },
    { "shot": "R09", "until": 21.957, "note": "The logo, without its flares, its bursting orb or the X beams to white." },
    { "shot": "R11", "until": 36.513, "note": "The verse, slowed." },
    { "shot": "R13", "until": 40.485, "note": "The sunset and the blueprint." },
    { "shot": "R14", "until": 43.39 },
    { "shot": "R15", "until": 47.146 },
    { "shot": "R16", "until": 48.548, "note": "Taka in front of the school." },
    { "shot": "R17", "until": 49.416, "note": "The Watcher, without the tape tearing." },
    { "shots": ["R18", "R19"], "until": 50.384, "note": "The stencil card." },
    { "shots": ["R20", "R21"], "until": 51.335, "note": "The counters." },
    { "shot": "R23", "until": 53.138, "note": "The middle of the mech bay's pan." },
    { "shots": ["R24", "R26"], "until": 55.158, "note": "Lead beat 3: the middle of the third newcomer's turn toward us, slowed." },
    { "shot": "R28", "until": 56.063, "note": "The four founders, each held twice as long, in the hangar's time." },
    { "shot": "R29", "until": 56.968 },
    { "shot": "R30", "until": 57.874 },
    { "shot": "R31", "until": 58.78 },
    { "shots": ["R32", "R34"], "until": 62.452, "note": "The Frame: the middle of its long tilt up to its eye." },
    { "shot": "R35", "until": 65.34, "note": "The golden wings." },
    { "shot": "R40", "until": 66.32 },
    { "shots": ["R41", "R42"], "until": 67.3 },
    { "shots": ["R43", "R44"], "until": 68.3, "note": "The machinery pan (Ingram's tech-pan-01), in place of the quick close-ups and the core's flash." },
    { "shot": "R48", "until": 69.1 },
    { "shot": "R52", "until": 69.847, "note": "The gun bunker at sunset, before KUROSE (Ingram's bunker_pan)." },
    { "shot": "R53", "until": 70.848, "note": "A dozen of the fifty flashes, a beat or two each." },
    { "shot": "R54", "until": 71.849 },
    { "shot": "R55", "until": 72.818 },
    { "shot": "R65", "until": 73.753 },
    { "shot": "R71", "until": 74.737, "note": "The crane rig's red eye." },
    { "shots": ["R76", "R77"], "until": 76.29, "note": "The battleship. Manako is left out here, so nothing cuts from him straight into the blast (section 8)." },
    { "shots": ["R80", "R81"], "until": 77.492, "note": "The explosion, without its white flash." },
    { "shots": ["R85", "R88"], "until": 78.31, "note": "The conspiracy wall and its stamp." },
    { "shot": "R89", "until": 79.127, "note": "FIRST IMPACT." },
    { "shots": ["R90", "R91"], "until": 80.246, "note": "The stately house." },
    { "shots": ["R98", "R99"], "until": 81.247, "note": "The Gen 2 pilot's tilt: a second, a glimpse (LEDGER #37)." },
    { "shot": "R100", "until": 82.316 },
    { "shots": ["R101", "R105"], "until": 84.903, "note": "The vault door, pushing in slowly, without the stripe's wipe." },
    { "shots": ["R106", "R107"], "until": 86.822, "note": "The trainees in ranks, holding the lead beats' place until the group's own art comes." },
    { "shot": "R111", "until": "end", "motion": 1.0, "note": "The end card, as it is: still, its credit fading in, then out to black." }
  ],
  "drop_types": ["vhs_damage", "arcs"],
  "drop": [
    "pre-channels", "vhs-start",
    "r05-wash", "r06-crane", "r08-flash", "r08-flash-dark",
    "r09-flare-1", "r09-flare-2", "r09-flare-haze", "r09-orb", "r09-ring",
    "r10-beam-a", "r10-beam-b", "r10-ring", "r10-wash", "r10-sparkle",
    "r80-flash", "r84-light", "r84-glint", "r84-streak", "r84-white",
    "r101-stripe", "r101-chevrons", "r101-edge",
    "r109-glare", "r109-rays", "r109-strobe"
  ],
  "layer_overrides": {
    "pre-tape": { "strength": 0.0 },
    "r15-haze": { "amp": 2.25 }
  },
  "text": { "flicker": 0.0, "weave": 0 },
  "finish": { "vhs": { "dropouts": 0.0, "jitter": 0.3, "head": 0.5 } }
}
